{
  "$schema": "../../content/schemas/palette.schema.json",
  "id": "truenorth-core",
  "version": "1.0.0",
  "owner": "art",
  "licence": "CC-BY-4.0",
  "designResolution": {
    "width": 1080,
    "height": 1920
  },
  "note": [
    "The allow-list for every fill and stroke in assets/src/svg. The palette lint fails on any colour",
    "not present in `colours`. Add a colour here, with a ramp, before any SVG uses it.",
    "This file lives here. CLAUDE.md never named a canonical palette path, and a build-time input read",
    "by the asset pipeline and by make verify-art - never by anything under app/ - belongs beside the",
    "art it governs (same reasoning as assets/credits.json, ADR-0004). It is validated in place against",
    "content/schemas/palette.schema.json by make validate-content, which also cross-checks that every",
    "ramp tone and ink names a colour in `colours`.",
    "UI, text and focus-ring colours are deliberately absent: ui-a11y owns those and they must pass WCAG AA."
  ],
  "shading": {
    "tones": 3,
    "toneNames": [
      "light",
      "base",
      "shade"
    ],
    "rule": "Exactly three flat fills per material. No gradients, no dithering, no fourth tone. Author the BASE from the reference photograph, then derive light and shade with the formula below. Do not eyeball the other two tones.",
    "keyLight": "Warm sun, upper left, 35 degrees above horizontal. One key for the whole game.",
    "ambient": "Cool sky and snow bounce.",
    "formula": {
      "light": {
        "lightnessDelta": "+15 (clamped at 96)",
        "hueRotation": "8 degrees toward 45 (warm)",
        "saturation": "x1.00 if base S < 12 (neutral); x0.92 if S <= 45; x0.97 otherwise"
      },
      "shade": {
        "lightnessDelta": "-16 (clamped at 8)",
        "hueRotation": "12 degrees toward 225 (cool); toward 350 for the skin and hair families",
        "saturation": "unchanged if base S < 12 (neutrals stay neutral); otherwise S + (92 - S) * 0.10"
      },
      "familyOverrides": {
        "skin": {
          "shadeHueTarget": 350,
          "lightSaturation": "x0.80",
          "shadeSaturation": "x0.78",
          "why": "Flesh shadow turns red-violet, not blue, and loses saturation. Without this, pale skin shadows go orange and deep skin highlights go ochre."
        },
        "hair": {
          "shadeHueTarget": 350,
          "lightSaturation": "x0.90",
          "shadeSaturation": "x0.95"
        }
      },
      "colourSpace": "HSL over sRGB, hue in degrees, S and L in percent."
    },
    "acceptanceBand": {
      "minAdjacentLightnessDelta": 8,
      "targetAdjacentLightnessDelta": 15,
      "note": "15 is what the formula produces. The floor is 8 rather than 15 because ramps whose base sits near L=8 or L=96 clamp: skin-6 and hair-black cannot span 15 twice without going to black. A ramp that clamps is correct; a ramp that was eyeballed flat is not."
    },
    "exemptions": [
      "sky",
      "cloud",
      "dusk",
      "snow"
    ],
    "exemptionReason": "Atmosphere ramps are vertical band sets, not a lit material, and snow clamps at white. They are authored by hand and are the only ramps the formula does not govern."
  },
  "outline": {
    "appliesTo": "characters only",
    "neverAppliesTo": [
      "landmarks",
      "buildings",
      "props",
      "background layers",
      "particles",
      "UI"
    ],
    "silhouettePx": 6,
    "majorInternalPx": 4,
    "minorInternalPx": 3,
    "minimumPx": 3,
    "cap": "round",
    "join": "round",
    "constantWidth": true,
    "whyConstantWidth": "Tapered strokes alias badly at atlas mip levels and cannot be expressed as a Rive shape stroke.",
    "colourRule": "Use the ink whose hue family matches the character's largest colour area. Never #000000.",
    "backgroundSeparationRule": "A background shape that does not read without a line has the wrong tone. Change the tone. Do not add a line."
  },
  "ambientOcclusion": {
    "colour": "ao-shadow",
    "mode": "multiply",
    "overlapAlpha": 0.18,
    "groundContactAlpha": 0.28,
    "maxBlurRadiusPx": 24,
    "rule": "Baked as soft shapes in the SVG, never as a runtime filter: the Canvas visual tier has no Filters (slice-1 task 1.19). AO goes where forms meet the ground and where parts overlap, nowhere else."
  },
  "colours": {
    "sky-light": "#a5d6ee",
    "sky-base": "#3d8ccb",
    "sky-shade": "#1f5fa8",
    "cloud-light": "#fbfdfe",
    "cloud-base": "#dce9f3",
    "cloud-shade": "#b9cfe2",
    "dusk-light": "#f0a15e",
    "dusk-base": "#8a5e9e",
    "dusk-shade": "#3a3d77",
    "snow-light": "#ffffff",
    "snow-base": "#e6eff7",
    "snow-shade": "#c2d6e8",
    "stone-light": "#d2c5a3",
    "stone-base": "#bc9c6d",
    "stone-shade": "#9a623e",
    "limestone-light": "#c8c1b6",
    "limestone-base": "#a99789",
    "limestone-shade": "#8a6256",
    "brick-light": "#cb8f62",
    "brick-base": "#ab5936",
    "brick-shade": "#6f271f",
    "oxide-light": "#cf5d2b",
    "oxide-base": "#91301c",
    "oxide-shade": "#4e0e10",
    "cobalt-light": "#2275c6",
    "cobalt-base": "#153f86",
    "cobalt-shade": "#091740",
    "copper-light": "#80caaa",
    "copper-base": "#46b896",
    "copper-shade": "#2b8179",
    "slate-light": "#7d8fa0",
    "slate-base": "#57647a",
    "slate-shade": "#30384f",
    "ice-light": "#e4f2f6",
    "ice-base": "#a9d0e5",
    "ice-shade": "#6799d6",
    "water-light": "#5cbfd6",
    "water-base": "#2c8cba",
    "water-shade": "#1a487a",
    "glacier-light": "#b4d5cc",
    "glacier-base": "#81bbb3",
    "glacier-shade": "#4b9aa0",
    "pine-light": "#41b76b",
    "pine-base": "#2c8055",
    "pine-shade": "#154536",
    "grass-light": "#89c05f",
    "grass-base": "#56993a",
    "grass-shade": "#276121",
    "pasture-light": "#9dac53",
    "pasture-base": "#677b37",
    "pasture-shade": "#30451c",
    "wood-light": "#c5994d",
    "wood-base": "#96632f",
    "wood-shade": "#5a2d19",
    "path-light": "#afaca5",
    "path-base": "#8b857c",
    "path-shade": "#605a55",
    "flag-red-light": "#e27468",
    "flag-red-base": "#d8262c",
    "flag-red-shade": "#941835",
    "navy-light": "#464c92",
    "navy-base": "#2b3660",
    "navy-shade": "#101629",
    "brass-light": "#e1c368",
    "brass-base": "#d6a727",
    "brass-shade": "#935a18",
    "leather-light": "#b4733b",
    "leather-base": "#7c4327",
    "leather-shade": "#401812",
    "felt-light": "#d5c18e",
    "felt-base": "#c29455",
    "felt-shade": "#965630",
    "hide-light": "#44555f",
    "hide-base": "#242b33",
    "hide-shade": "#0f121a",
    "skin-1-light": "#f6ecde",
    "skin-1-base": "#efbe99",
    "skin-1-shade": "#d47d62",
    "skin-2-light": "#e8d4bb",
    "skin-2-base": "#dfa477",
    "skin-2-shade": "#be6246",
    "skin-3-light": "#d1b692",
    "skin-3-base": "#c68550",
    "skin-3-shade": "#894f3b",
    "skin-4-light": "#bc9662",
    "skin-4-base": "#9e6334",
    "skin-4-shade": "#593327",
    "skin-5-light": "#a97c41",
    "skin-5-base": "#7a4923",
    "skin-5-shade": "#361d15",
    "skin-6-light": "#865f33",
    "skin-6-base": "#553018",
    "skin-6-shade": "#1d0f0b",
    "hair-black-light": "#5a5365",
    "hair-black-base": "#33303c",
    "hair-black-shade": "#141217",
    "hair-brown-light": "#936a38",
    "hair-brown-base": "#5f3a20",
    "hair-brown-shade": "#21110c",
    "hair-blond-light": "#decc96",
    "hair-blond-base": "#d2ae55",
    "hair-blond-shade": "#a66c30",
    "hair-red-light": "#d18547",
    "hair-red-base": "#a94d22",
    "hair-red-shade": "#631f16",
    "hair-grey-light": "#e1e1e4",
    "hair-grey-base": "#b8b8c0",
    "hair-grey-shade": "#908d99",
    "serge-light": "#db7961",
    "serge-base": "#c5342a",
    "serge-shade": "#841a28",
    "white-light": "#ffffff",
    "white-base": "#f0f2f5",
    "white-shade": "#cbd2da",
    "ink-warm": "#3a2018",
    "ink-cool": "#1a2036",
    "ink-neutral": "#251f23",
    "ao-shadow": "#16203a"
  },
  "ramps": {
    "sky": {
      "light": "sky-light",
      "base": "sky-base",
      "shade": "sky-shade",
      "derived": false,
      "note": "Band order top to bottom is shade (zenith), base, light (horizon). Three flat bands."
    },
    "cloud": {
      "light": "cloud-light",
      "base": "cloud-base",
      "shade": "cloud-shade",
      "derived": false
    },
    "dusk": {
      "light": "dusk-light",
      "base": "dusk-base",
      "shade": "dusk-shade",
      "derived": false,
      "note": "Alternative sky set for a dusk section. Never mix dusk and sky in one layer."
    },
    "snow": {
      "light": "snow-light",
      "base": "snow-base",
      "shade": "snow-shade",
      "derived": false
    },
    "stone": {
      "light": "stone-light",
      "base": "stone-base",
      "shade": "stone-shade",
      "derived": true,
      "material": "Nepean sandstone. Parliament Hill walls and the Peace Tower shaft. Also the cut banks of the Yukon River valley on the-north level, MEASURED at hsl(43,23%,45%) on a 500x150 of assets/refs/the-north/yukon-river-bluff-and-aspen.jpg at (400,400) against stone-base's hsl(36,37%,58%): seven degrees of hue, but fourteen points less saturated and thirteen points darker, because that bank is in haze and in its own shadow. Recorded as the widest gap this ramp is asked to carry rather than rounded away."
    },
    "limestone": {
      "light": "limestone-light",
      "base": "limestone-base",
      "shade": "limestone-shade",
      "derived": true,